Timestamp,Please rate: Video 1's quality,Which incidents did Video 1 contain?,Please rate: Video 2's quality,Which incidents did Video 2 contain?,Please rate: Video 3's quality,Which incidents did Video 3 contain?,Please rate: Video 4's quality,Which incidents did Video 4 contain?,Please rate: Video 5's quality,Which incidents did Video 5 contain?,Please rate: Video 6's quality,Which incidents did Video 6 contain?,Please rate: Video 7's quality,Which incidents did Video 7 contain?,Please rate: Video 8's quality,Which incidents did Video 8 contain?,How did the quality damage affect your experience?,Is our guideline clear? Please tell us anything you got confused with.
11/17/2022 9:41:32,3,Freezing/Buffering,3,Freezing/Buffering,3,Freezing/Buffering,4,None,3,Freezing/Buffering,4,None,3,Freezing/Buffering,5,None,Freeze greatly hurts my experience while blurring does as well but to a lesser extent.,
11/17/2022 10:37:39,3,Freezing/Buffering,3,Freezing/Buffering,4,Freezing/Buffering,4,None,3,Freezing/Buffering,5,None,5,None,3,Freezing/Buffering,Nearly no ,I think it's clear
11/17/2022 15:50:59,4,Freezing/Buffering,4,Freezing/Buffering,4,Freezing/Buffering,5,None,5,Freezing/Buffering,5,None,3,Freezing/Buffering,4,None,The freezing makes me distracted and want to stop watching video cause it's irritating.,
11/17/2022 16:28:54,3,None,2,Freezing/Buffering,4,None,4,None,5,None,5,None,4,Freezing/Buffering,5,None,"I had to wait until the video start, so it was little annoying","Yes, but the score standard was kind of hard to understand, like I was not sure what do you expect for the score 1 and 5. "
11/17/2022 17:06:13,3,None,2,Freezing/Buffering,3,Freezing/Buffering,4,None,5,Freezing/Buffering,4,Freezing/Buffering,2,Freezing/Buffering,4,None,I think doesn't influence much,"Yes, cool"
11/17/2022 18:06:22,4,Freezing/Buffering,3,Freezing/Buffering,4,Freezing/Buffering,5,None,3,Freezing/Buffering,5,None,4,Freezing/Buffering,5,None,"It mildly affected my experience, especially in the videos where there is lots of movement.",I thought there would be only one video without buffering but I felt that there were multiple.
11/19/2022 12:07:17,5,None,4,Freezing/Buffering,3,Freezing/Buffering,3,Freezing/Buffering,3,Freezing/Buffering,4,None,3,None,4,None,It was not a big issue from my experience.,Guideline was clear