Timestamp,Please rate: Video 1's quality,Which incidents did Video 1 contain?,Please rate: Video 2's quality,Which incidents did Video 2 contain?,Please rate: Video 3's quality,Which incidents did Video 3 contain?,Please rate: Video 4's quality,Which incidents did Video 4 contain?,Please rate: Video 5's quality,Which incidents did Video 5 contain?,Please rate: Video 6's quality,Which incidents did Video 6 contain?,Please rate: Video 7's quality,Which incidents did Video 7 contain?,Please rate: Video 8's quality,Which incidents did Video 8 contain?,How did the quality damage affect your experience?,Is our guideline clear? Please tell us anything you got confused with.
11/17/2022 14:40:32,3,Freezing/Buffering,5,Freezing/Buffering,5,None,4,Freezing/Buffering,5,Freezing/Buffering,4,Freezing/Buffering,5,None,2,Freezing/Buffering,,
11/17/2022 15:30:23,4,Freezing/Buffering,4,None,4,None,4,Freezing/Buffering,4,Freezing/Buffering,4,None,5,Freezing/Buffering,4,Freezing/Buffering,,
11/17/2022 15:52:50,3,None,3,Freezing/Buffering,4,None,4,None,2,Freezing/Buffering,4,Freezing/Buffering,5,None,5,None,Yes; I can't stand pixelated images,Yes
11/17/2022 16:09:54,3,Freezing/Buffering,3,Freezing/Buffering,4,None,2,Freezing/Buffering,3,Freezing/Buffering,3,Freezing/Buffering,4,None,4,Freezing/Buffering,At some pauses the buffering was had a bad impact.,Yes it was clear.
11/17/2022 16:10:06,4,Freezing/Buffering,3,Freezing/Buffering,4,None,4,Freezing/Buffering,4,Freezing/Buffering,4,Freezing/Buffering,4,None,4,None,,"yes, it was clear. Nothing confusing."
11/17/2022 16:10:29,1,Freezing/Buffering,4,None,4,None,2,Freezing/Buffering,2,Freezing/Buffering,2,Freezing/Buffering,5,None,5,None,"It affected the experience as there were pauses. Once we are watching something, pauses are not appreciated. It can lead to frustration or stop the video in between.",Yes. The guidelines were clear.
11/17/2022 16:23:11,2,Freezing/Buffering,3,Freezing/Buffering,5,None,3,Freezing/Buffering,3,Freezing/Buffering,3,Freezing/Buffering,5,None,4,Freezing/Buffering,"Pretty, but it also depends on the content",clear
11/17/2022 18:56:33,4,Freezing/Buffering,3,Freezing/Buffering,5,None,4,Freezing/Buffering,4,Freezing/Buffering,4,Freezing/Buffering,5,None,5,None,Very minimally,The instructions made sense. The last video looked like it might have had a freeze but it was hard to tell because of lack of clear motion
11/17/2022 20:26:29,3,None,3,None,3,None,3,None,3,None,3,None,3,None,3,None,,